Iteration 1 of 10
Transcript: /d/applications/sitemap/.aidd/iterations/002.log
Started: 2026-01-07T11:28:08-06:00

Detected incomplete onboarding, resuming onboarding prompt...
Copying artifacts to '/d/applications/sitemap/.aidd'...
I'll help you initialize the development foundation for this project. Let me start by checking for project-specific overrides and understanding the codebase structure.
[96m[1m| [0m[90m Read     [0mCLAUDE.md
[94m[1m| [0m[90m Glob     [0m{"pattern":"/.autoo/**/*"}
[94m[1m| [0m[90m Glob     [0m{"pattern":"/.aidd/**/*"}
[91m[1m| [0m[90m Bash     [0mList directory contents

total 34
drwxr-xr-x 1 phill 197609     0 Jan  7 11:28 .
drwxr-xr-x 1 phill 197609     0 Jan  7 10:54 ..
drwxr-xr-x 1 phill 197609     0 Jan  7 11:28 .aidd
drwxr-xr-x 1 phill 197609     0 Jan  7 11:22 .automaker
drwxr-xr-x 1 phill 197609     0 Jan  7 11:21 .git
-rw-r--r-- 1 phill 197609   673 Dec 19 02:15 .gitattributes
-rw-r--r-- 1 phill 197609   115 Jan  7 08:28 .gitignore
-rw-r--r-- 1 phill 197609   100 Dec 20 23:45 .prettierignore
-rw-r--r-- 1 phill 197609   592 Nov 24 17:08 .prettierrc
-rw-r--r-- 1 phill 197609   145 Dec 20 15:15 babel.config.cjs
-rw-r--r-- 1 phill 197609  1475 Dec 20 14:25 CLAUDE.md
-rw-r--r-- 1 phill 197609  2571 Dec 12 15:09 eslint.config.js
-rw-r--r-- 1 phill 197609   940 Dec 27 23:16 index.html
-rw-r--r-- 1 phill 197609  1579 Dec 23 01:04 jest.config.cjs
-rw-r--r-- 1 phill 197609  2441 Dec 23 19:33 package.json
-rw-r--r-- 1 phill 197609    86 Dec 20 15:20 postcss.config.js
drwxr-xr-x 1 phill 197609     0 Dec 27 23:15 public
-rw-r--r-- 1 phill 197609 10222 Jan  7 11:12 README.md
drwxr-xr-x 1 phill 197609     0 Dec 22 23:55 src
-rw-r--r-- 1 phill 197609   962 Dec 20 14:28 tailwind.config.js
-rw-r--r-- 1 phill 197609   639 Dec 20 14:28 tsconfig.json
-rw-r--r-- 1 phill 197609   518 Dec 20 14:28 vite.config.ts

[96m[1m| [0m[90m Read     [0m.aidd\project_structure.md
[96m[1m| [0m[90m Read     [0mpackage.json
[96m[1m| [0m[90m Read     [0m.aidd\progress.md
[96m[1m| [0m[90m Read     [0m.aidd\app_spec.txt
[94m[1m| [0m[90m Glob     [0m{"pattern":"/.aidd/spec.txt"}
[96m[1m| [0m[90m Read     [0mREADME.md
[94m[1m| [0m[90m Glob     [0m{"pattern":"/.aidd/feature_list.json"}
[91m[1m| [0m[90m Bash     [0mList src directory contents

total 14
drwxr-xr-x 1 phill 197609    0 Dec 22 23:55 .
drwxr-xr-x 1 phill 197609    0 Jan  7 11:28 ..
drwxr-xr-x 1 phill 197609    0 Dec 23 00:00 __tests__
drwxr-xr-x 1 phill 197609    0 Dec 23 01:09 components
-rw-r--r-- 1 phill 197609  227 Dec 20 15:09 demo.tsx
-rw-r--r-- 1 phill 197609 1632 Dec 27 23:13 DemoApp.tsx
drwxr-xr-x 1 phill 197609    0 Dec 22 23:51 hooks
-rw-r--r-- 1 phill 197609 4450 Dec 22 23:55 index.ts
-rw-r--r-- 1 phill 197609  514 Dec 22 22:58 setupTests.ts
drwxr-xr-x 1 phill 197609    0 Dec 20 12:51 styles
drwxr-xr-x 1 phill 197609    0 Dec 20 14:44 theme
drwxr-xr-x 1 phill 197609    0 Dec 22 23:47 types
drwxr-xr-x 1 phill 197609    0 Dec 22 23:58 utils

[91m[1m| [0m[90m Bash     [0mList components directory

total 320
drwxr-xr-x 1 phill 197609     0 Dec 23 01:09 .
drwxr-xr-x 1 phill 197609     0 Dec 22 23:55 ..
-rw-r--r-- 1 phill 197609 17624 Dec 22 19:03 BasicTree.tsx
-rw-r--r-- 1 phill 197609 28396 Dec 23 17:47 D3TreeDiagram.tsx
-rw-r--r-- 1 phill 197609 14243 Dec 23 01:03 DiffViewer.tsx
-rw-r--r-- 1 phill 197609 17489 Dec 20 22:53 ExportButton.tsx
-rw-r--r-- 1 phill 197609 17614 Dec 22 18:42 FlowchartDiagram.tsx
-rw-r--r-- 1 phill 197609  8564 Jan  7 11:15 HorizontalNavBar.tsx
-rw-r--r-- 1 phill 197609  2302 Dec 22 23:22 index.ts
-rw-r--r-- 1 phill 197609  7351 Dec 20 14:35 InlineEditInput.tsx
-rw-r--r-- 1 phill 197609 15526 Dec 23 01:03 KeyboardShortcutsHelp.tsx
-rw-r--r-- 1 phill 197609 10686 Dec 20 14:35 ResponsiveCardGrid.tsx
-rw-r--r-- 1 phill 197609 13287 Dec 23 01:03 SearchableTree.tsx
-rw-r--r-- 1 phill 197609 15712 Dec 23 01:03 SearchPanel.tsx
-rw-r--r-- 1 phill 197609 36249 Dec 27 23:11 SelectableTree.tsx
-rw-r--r-- 1 phill 197609 22331 Dec 27 23:19 SitemapEditor.tsx
-rw-r--r-- 1 phill 197609 10303 Dec 23 01:03 SitemapEditorWithComparison.tsx
-rw-r--r-- 1 phill 197609 17538 Dec 20 15:23 TreeNodeComponent.tsx
-rw-r--r-- 1 phill 197609  7022 Dec 21 00:52 TreeNodeUtils.ts
-rw-r--r-- 1 phill 197609 14080 Dec 23 01:03 VersionManager.tsx
-rw-r--r-- 1 phill 197609 15946 Dec 22 22:55 VirtualizedTree.tsx

[91m[1m| [0m[90m Bash     [0mList utils directory

total 126
drwxr-xr-x 1 phill 197609     0 Dec 22 23:58 .
drwxr-xr-x 1 phill 197609     0 Dec 22 23:55 ..
-rw-r--r-- 1 phill 197609  1729 Dec 22 23:23 index.ts
-rw-r--r-- 1 phill 197609 18161 Dec 20 14:35 parserErrors.ts
-rw-r--r-- 1 phill 197609  7407 Dec 20 22:53 pngExport.ts
-rw-r--r-- 1 phill 197609 11495 Dec 20 14:38 sitemapGenerator.ts
-rw-r--r-- 1 phill 197609  9588 Dec 22 23:34 svgExport.ts
-rw-r--r-- 1 phill 197609 12860 Dec 23 01:03 treeComparison.ts
-rw-r--r-- 1 phill 197609  2375 Dec 22 22:55 treeFlattening.ts
-rw-r--r-- 1 phill 197609  7249 Dec 22 18:32 treeOperations.ts
-rw-r--r-- 1 phill 197609 14702 Dec 20 14:38 treeParser.ts
-rw-r--r-- 1 phill 197609 15745 Dec 22 22:55 treeSearch.ts
-rw-r--r-- 1 phill 197609 11070 Dec 23 01:03 versionStorage.ts


[91m[1m| [0m[90m Bash     [0mList hooks directory
total 60
drwxr-xr-x 1 phill 197609     0 Dec 22 23:51 .
drwxr-xr-x 1 phill 197609     0 Dec 22 23:55 ..
-rw-r--r-- 1 phill 197609  1056 Dec 22 23:21 index.ts
-rw-r--r-- 1 phill 197609  1832 Dec 22 21:41 useDebounce.ts
-rw-r--r-- 1 phill 197609  7861 Dec 23 01:03 useTreeComparison.ts
-rw-r--r-- 1 phill 197609 13598 Dec 22 23:12 useTreeKeyboardNavigation.ts
-rw-r--r-- 1 phill 197609  7645 Dec 20 14:35 useTreeNodeEditing.ts
-rw-r--r-- 1 phill 197609  5441 Dec 22 21:42 useTreeParser.ts
-rw-r--r-- 1 phill 197609 12464 Dec 22 21:44 useTreeSearch.ts

[91m[1m| [0m[90m Bash     [0mList types directory

total 18
drwxr-xr-x 1 phill 197609     0 Dec 22 23:47 .
drwxr-xr-x 1 phill 197609     0 Dec 22 23:55 ..
-rw-r--r-- 1 phill 197609  1213 Dec 20 13:47 index.ts
-rw-r--r-- 1 phill 197609 15802 Dec 22 23:47 TreeNode.ts

[96m[1m| [0m[90m Read     [0m.aidd\pipeline.json
[96m[1m| [0m[90m Read     [0m.aidd\categories.json
[96m[1m| [0m[90m Read     [0msrc\components\index.ts
[96m[1m| [0m[90m Read     [0msrc\index.ts
[91m[1m| [0m[90m Bash     [0mList test directory

total 325
drwxr-xr-x 1 phill 197609     0 Dec 23 00:00 .
drwxr-xr-x 1 phill 197609     0 Dec 22 23:55 ..
-rw-r--r-- 1 phill 197609 25687 Dec 20 15:35 BasicTree.test.tsx
-rw-r--r-- 1 phill 197609 31210 Dec 22 22:55 D3TreeDiagram.test.tsx
-rw-r--r-- 1 phill 197609    52 Dec 22 22:58 global.d.ts
-rw-r--r-- 1 phill 197609 10271 Dec 20 14:35 InlineEditInput.test.tsx
-rw-r--r-- 1 phill 197609 18497 Dec 20 14:38 parserErrors.test.ts
-rw-r--r-- 1 phill 197609  5125 Dec 23 17:37 pngExport.test.ts
-rw-r--r-- 1 phill 197609 18196 Dec 20 14:35 ResponsiveCardGrid.test.tsx
-rw-r--r-- 1 phill 197609 32165 Dec 23 17:44 SelectableTree.test.tsx
-rw-r--r-- 1 phill 197609 16086 Dec 23 17:43 SitemapEditor.test.tsx
-rw-r--r-- 1 phill 197609 15331 Dec 20 14:36 sitemapGenerator.test.ts
-rw-r--r-- 1 phill 197609  8072 Dec 23 17:37 svgExport.test.ts
-rw-r--r-- 1 phill 197609  9066 Dec 23 01:03 treeComparison.test.ts
-rw-r--r-- 1 phill 197609 11871 Dec 20 14:36 TreeNode.test.ts
-rw-r--r-- 1 phill 197609 29212 Dec 20 15:03 TreeNodeComponent.test.tsx
-rw-r--r-- 1 phill 197609  2066 Dec 20 23:38 treeOperations.test.ts
-rw-r--r-- 1 phill 197609 14493 Dec 20 14:35 treeParser.test.ts
-rw-r--r-- 1 phill 197609 14270 Dec 23 01:05 treeSearch.test.ts
-rw-r--r-- 1 phill 197609 13709 Dec 20 14:35 useTreeNodeEditing.test.ts
-rw-r--r-- 1 phill 197609  9975 Dec 20 14:35 useTreeParser.test.ts
-rw-r--r-- 1 phill 197609  8461 Dec 23 01:05 versionStorage.test.ts

[91m[1m| [0m[90m Bash     [0mFind test files

D:\applications\sitemap\src\__tests__/BasicTree.test.tsx
D:\applications\sitemap\src\__tests__/D3TreeDiagram.test.tsx
D:\applications\sitemap\src\__tests__/InlineEditInput.test.tsx
D:\applications\sitemap\src\__tests__/parserErrors.test.ts
D:\applications\sitemap\src\__tests__/pngExport.test.ts
D:\applications\sitemap\src\__tests__/ResponsiveCardGrid.test.tsx
D:\applications\sitemap\src\__tests__/SelectableTree.test.tsx
D:\applications\sitemap\src\__tests__/SitemapEditor.test.tsx
D:\applications\sitemap\src\__tests__/sitemapGenerator.test.ts
D:\applications\sitemap\src\__tests__/svgExport.test.ts
D:\applications\sitemap\src\__tests__/treeComparison.test.ts
D:\applications\sitemap\src\__tests__/TreeNode.test.ts
D:\applications\sitemap\src\__tests__/TreeNodeComponent.test.tsx
D:\applications\sitemap\src\__tests__/treeOperations.test.ts
D:\applications\sitemap\src\__tests__/treeParser.test.ts
D:\applications\sitemap\src\__tests__/treeSearch.test.ts
D:\applications\sitemap\src\__tests__/useTreeNodeEditing.test.ts
D:\applications\sitemap\src\__tests__/useTreeParser.test.ts
D:\applications\sitemap\src\__tests__/versionStorage.test.ts

[96m[1m| [0m[90m Read     [0msrc\types\TreeNode.ts
[94m[1m| [0m[90m Glob     [0m{"pattern":"/.windsurf/**/*"}
[91m[1m| [0m[90m Bash     [0mList windsurf directory

ls: cannot access 'D:\applications\sitemap\.windsurf': No such file or directory

Now I'll create the comprehensive feature_list.json based on the spec and existing codebase analysis:
[91m[1m| [0m[90m Bash     [0mCheck if feature_list.json exists

exists

[96m[1m| [0m[90m Read     [0m.aidd\feature_list.json
Good! A feature_list.json already exists. Let me now create the project_structure.md document and update progress.md:
[96m[1m| [0m[90m Read     [0m.aidd\project_structure.md
[96m[1m| [0m[90m Read     [0m.aidd\progress.md
[91m[1m| [0m[90m Bash     [0mRun smoke quality checks

$ bun run lint:fix && bun run typecheck && bun run format && bun run build && bun run test
$ eslint src --report-unused-disable-directives --max-warnings 0 --fix
node:internal/modules/cjs/loader:1423
  throw err;
  ^

Error: Cannot find module 'D:\packages\npm\node_modules\eslint\bin\eslint.js'
    at Module._resolveFilename (node:internal/modules/cjs/loader:1420:15)
    at defaultResolveImpl (node:internal/modules/cjs/loader:1058:19)
    at resolveForCJSWithHooks (node:internal/modules/cjs/loader:1063:22)
    at Module._load (node:internal/modules/cjs/loader:1226:37)
    at TracingChannel.traceSync (node:diagnostics_channel:328:14)
    at wrapModuleLoad (node:internal/modules/cjs/loader:245:24)
    at Module.executeUserEntryPoint [as runMain] (node:internal/modules/run_main:154:5)
    at node:internal/main/run_main_module:33:47 {
  code: 'MODULE_NOT_FOUND',
  requireStack: []
}

Node.js v25.2.1
error: script "lint:fix" exited with code 1
error: script "smoke:qc" exited with code 1

[91m[1m| [0m[90m Bash     [0mCheck node location


/c/Program Files/nodejs/node
[91m[1m| [0m[90m Bash     [0mCheck ESLint version

node:internal/modules/cjs/loader:1423
  throw err;
  ^

Error: Cannot find module 'D:\packages\npm\node_modules\eslint\bin\eslint.js'
    at Module._resolveFilename (node:internal/modules/cjs/loader:1420:15)
    at defaultResolveImpl (node:internal/modules/cjs/loader:1058:19)
    at resolveForCJSWithHooks (node:internal/modules/cjs/loader:1063:22)
    at Module._load (node:internal/modules/cjs/loader:1226:37)
    at TracingChannel.traceSync (node:diagnostics_channel:328:14)
    at wrapModuleLoad (node:internal/modules/cjs/loader:245:24)
    at Module.executeUserEntryPoint [as runMain] (node:internal/modules/run_main:154:5)
    at node:internal/main/run_main_module:33:47 {
  code: 'MODULE_NOT_FOUND',
  requireStack: []
}

Node.js v25.2.1

[91m[1m| [0m[90m Bash     [0mCheck NODE_PATH env
[91m[1m| [0m[90m Bash     [0mCheck bun version

1.3.5

[91m[1m| [0m[90m Bash     [0mCheck bun binary path

D:\applications\sitemap\node_modules\.bin

[91m[1m| [0m[90m Bash     [0mRun lint directly

$ eslint src --report-unused-disable-directives --max-warnings 0
node:internal/modules/cjs/loader:1423
  throw err;
  ^

Error: Cannot find module 'D:\packages\npm\node_modules\eslint\bin\eslint.js'
    at Module._resolveFilename (node:internal/modules/cjs/loader:1420:15)
    at defaultResolveImpl (node:internal/modules/cjs/loader:1058:19)
    at resolveForCJSWithHooks (node:internal/modules/cjs/loader:1063:22)
    at Module._load (node:internal/modules/cjs/loader:1226:37)
    at TracingChannel.traceSync (node:diagnostics_channel:328:14)
    at wrapModuleLoad (node:internal/modules/cjs/loader:245:24)
    at Module.executeUserEntryPoint [as runMain] (node:internal/modules/run_main:154:5)
    at node:internal/main/run_main_module:33:47 {
  code: 'MODULE_NOT_FOUND',
  requireStack: []
}

Node.js v25.2.1
error: script "lint" exited with code 1

[96m[1m| [0m[90m Read     [0meslint.config.js
[91m[1m| [0m[90m Bash     [0mCheck if eslint is installed

ls: cannot access 'D:\applications\sitemap\node_modules\eslint': No such file or directory

[91m[1m| [0m[90m Bash     [0mCheck node_modules

ls: cannot access 'D:\applications\sitemap\node_modules': No such file or directory

[91m[1m| [0m[90m Bash     [0mInstall dependencies

bun install v1.3.5 (1e86cebd)
Resolving dependencies
Resolved, downloaded and extracted [587]
Saved lockfile

+ @babel/core@7.28.5
+ @babel/preset-env@7.28.5
+ @playwright/test@1.57.0
+ @tailwindcss/postcss@4.1.18
+ @testing-library/jest-dom@6.9.1
+ @testing-library/react@16.3.1
+ @trivago/prettier-plugin-sort-imports@6.0.2
+ @types/jest@30.0.0
+ @types/node@25.0.3
+ @types/react@19.2.7
+ @types/react-dom@19.2.3
+ @typescript-eslint/eslint-plugin@8.52.0
+ @typescript-eslint/parser@8.52.0
+ @vitejs/plugin-react@5.1.2
+ autoprefixer@10.4.23
+ babel-jest@30.2.0
+ eslint@9.39.2
+ eslint-config-prettier@10.1.8
+ eslint-formatter-compact@9.0.1
+ eslint-plugin-prettier@5.5.4
+ eslint-plugin-react-hooks@7.0.1
+ eslint-plugin-react-refresh@0.4.26
+ eslint-plugin-sort-keys-fix@1.1.2
+ identity-obj-proxy@3.0.0
+ jest@30.2.0
+ jest-environment-jsdom@30.2.0
+ postcss@8.5.6
+ prettier@3.7.4
+ prettier-plugin-organize-attributes@1.0.0
+ prettier-plugin-sort-json@4.1.1
+ prettier-plugin-tailwindcss@0.7.2
+ tailwindcss@4.1.18
+ ts-jest@29.4.6
+ typescript@5.9.3
+ typescript-eslint@8.52.0
+ vite@7.3.1
+ @types/d3@7.4.3
+ @types/react-window@2.0.0
+ @xyflow/react@12.10.0
+ d3@7.9.0
+ react@19.2.3
+ react-dom@19.2.3
+ react-window@2.2.4

655 packages installed [15.24s]

[91m[1m| [0m[90m Bash     [0mRun smoke quality checks

      √ should have aria-label on SVG (1 ms)
      √ should have title and desc elements for SVG (2 ms)
      √ should have aria-label for empty tree (2 ms)
    zoom functionality
      √ should enable zoom by default (15 ms)
      √ should disable zoom when enableZoom is false (15 ms)
    integration with parser
      √ should render tree from parseAndBuildTree output (4 ms)
      √ should handle complex sitemap structures (5 ms)
    depth-based styling
      √ should apply blue color for depth 0 (page level) (6 ms)
      √ should apply gray color for depth 1 (section level) (9 ms)
      √ should apply darker gray for depth 2 (component level) (2 ms)
      √ should apply progressively lighter gray for deeper levels (18 ms)
      √ should apply larger node size for depth 0 (2 ms)
      √ should apply progressively smaller node sizes for deeper levels (13 ms)
      √ should apply thicker stroke width for depth 0 (9 ms)
      √ should apply progressively thinner stroke widths for deeper levels (16 ms)
      √ should apply depth-based font sizes to text labels (5 ms)
      √ should apply depth-based font weights to text labels (2 ms)
      √ should still respect metadata style overrides (4 ms)
    edge cases
      √ should handle nodes with special characters in labels (13 ms)
      √ should handle nodes with empty string labels (2 ms)
      √ should handle nodes with long labels (13 ms)
      √ should handle single node tree (4 ms)
      √ should handle wide tree with many siblings (12 ms)
    animation settings
      √ should accept custom animation duration (16 ms)
      √ should handle zero animation duration (16 ms)
    margin customization
      √ should apply custom margins (7 ms)
    SVG rendering optimizations
      √ should inject GPU acceleration styles when useGPUAcceleration is true (8 ms)
      √ should support labelVisibilityThreshold prop (15 ms)
      √ should support maxLabelWidth prop (3 ms)
      √ should render long labels (truncation works in browser, not jsdom) (12 ms)
      √ should create label groups for text clipping (17 ms)
      √ should add clipPath definition to SVG defs (14 ms)
      √ should apply initial label visibility class (4 ms)
      √ should not add D3 transition handlers when useGPUAcceleration is true (12 ms)

PASS src/__tests__/SitemapEditor.test.tsx (5.29 s)
  SitemapEditor
    rendering
      √ should render textarea and preview sections (88 ms)
      √ should render with initial value (22 ms)
      √ should display placeholder text when empty (7 ms)
      √ should apply custom className (5 ms)
      √ should set correct number of rows on textarea (5 ms)
    real-time preview
      √ should update preview instantly when typing (14 ms)
      √ should parse tree structure and display in preview (15 ms)
      √ should update preview on every keystroke (18 ms)
      √ should display empty state message when no nodes (5 ms)
    error display
      √ should display parsing errors when showErrors is true (13 ms)
      √ should hide errors when showErrors is false (9 ms)
      √ should clear errors when input becomes valid (38 ms)
    statistics display
      √ should show stats when showStats is true (10 ms)
      √ should hide stats when showStats is false (5 ms)
      √ should update stats in real-time (17 ms)
    preview visibility
      √ should show preview by default (4 ms)
      √ should hide preview when showPreview is false (1 ms)
    disabled state
      √ should disable textarea when disabled prop is true (4 ms)
      √ should not be disabled by default (3 ms)
    callbacks
      √ should call onTreeChange when tree changes (20 ms)
      √ should call onErrorsChange when errors change (16 ms)
      √ should call onInputChange when input changes (8 ms)
    tree props
      √ should pass treeProps to BasicTree (7 ms)
      √ should apply custom indentSize from treeProps (8 ms)
    parser options
      √ should pass parser options to the hook (9 ms)
    custom renderers
      √ should use custom renderErrors function (9 ms)
      √ should use custom renderStats function (10 ms)
    accessibility
      √ should have proper aria-label on textarea (4 ms)
      √ should have proper aria-label on preview (4 ms)
      √ should set aria-invalid when there are errors (8 ms)
      √ should set aria-invalid to false when valid (5 ms)
      √ should disable spellcheck on textarea (4 ms)
    complex interactions
      √ should handle rapid typing (36 ms)
      √ should handle clearing and re-entering text (26 ms)
      √ should handle complex sitemap structures (9 ms)
    labels
      √ should display custom textarea label (2 ms)
      √ should display custom preview label (2 ms)

Test Suites: 19 passed, 19 total
Tests:       689 passed, 689 total
Snapshots:   0 total
Time:        7.543 s, estimated 12 s
Ran all test suites.

[91m[1m| [0m[90m Bash     [0mCheck TypeScript types


$ tsc --noEmit
[91m[1m| [0m[90m Bash     [0mCheck ESLint

$ eslint src --report-unused-disable-directives --max-warnings 0

[91m[1m| [0m[90m Bash     [0mCheck build outputtotal 44
drwxr-xr-x 1 phill 197609     0 Jan  7 11:33 .
drwxr-xr-x 1 phill 197609     0 Jan  7 11:33 ..
drwxr-xr-x 1 phill 197609     0 Jan  7 11:33 components
-rw-r--r-- 1 phill 197609    45 Jan  7 11:33 demo.d.ts
-rw-r--r-- 1 phill 197609   103 Jan  7 11:33 demo.d.ts.map
-rw-r--r-- 1 phill 197609   555 Jan  7 11:33 demo.js
-rw-r--r-- 1 phill 197609   304 Jan  7 11:33 demo.js.map
-rw-r--r-- 1 phill 197609   143 Jan  7 11:33 DemoApp.d.ts
-rw-r--r-- 1 phill 197609   203 Jan  7 11:33 DemoApp.d.ts.map
-rw-r--r-- 1 phill 197609  2188 Jan  7 11:33 DemoApp.js
-rw-r--r-- 1 phill 197609  1132 Jan  7 11:33 DemoApp.js.map
drwxr-xr-x 1 phill 197609     0 Jan  7 11:33 hooks
-rw-r--r-- 1 phill 197609  3919 Jan  7 11:33 index.d.ts
-rw-r--r-- 1 phill 197609  2561 Jan  7 11:33 index.d.ts.map
-rw-r--r-- 1 phill 197609 16334 Jan  7 11:33 index.js
-rw-r--r-- 1 phill 197609  2527 Jan  7 11:33 index.js.map
-rw-r--r-- 1 phill 197609   258 Jan  7 11:33 setupTests.d.ts
-rw-r--r-- 1 phill 197609   149 Jan  7 11:33 setupTests.d.ts.map
-rw-r--r-- 1 phill 197609   641 Jan  7 11:33 setupTests.js



[91m[1m| [0m[90m Bash     [0mBuild project

$ tsc

[91m[1m| [0m[90m Bash     [0mShow changes summary

warning: in the working copy of '.aidd/iterations/002.log', CRLF will be replaced by LF the next time Git touches it
 .aidd/iterations/002.log | 283 +++++++++++++++++++++++++++++++++++++++++++++++
 index.html               |   2 +-
 2 files changed, 284 insertions(+), 1 deletion(-)

[91m[1m| [0m[90m Bash     [0mCheck git status

On branch master
Your branch is ahead of 'origin/master' by 1 commit.
  (use "git push" to publish your local commits)

Changes not staged for commit:
  (use "git add <file>..." to update what will be committed)
  (use "git restore <file>..." to discard changes in working directory)
	modified:   .aidd/iterations/002.log
	modified:   index.html

Untracked files:
  (use "git add <file>..." to include in what will be committed)
	bun.lock

no changes added to commit (use "git add" and/or "git commit -a")

[91m[1m| [0m[90m Bash     [0mShow recent commits

01b6570 onboard: Initialize AI development tracking foundation
eddd186 .
b3894a0 onboard: verify quality gates and update feature tracking
34eabe4 feat: add AI development infrastructure and documentation
6b0f29d .

[91m[1m| [0m[90m Bash     [0mShow index.html changes

diff --git a/index.html b/index.html
index 045f54a..15347aa 100644
--- a/index.html
+++ b/index.html
@@ -4,7 +4,7 @@
 		<meta charset="UTF-8" />
 		<meta content="width=device-width, initial-scale=1.0" name="viewport" />
 		<title>UX Sitemap Visualizer - Development</title>
-		<link rel="icon" type="image/svg+xml" href="/favicon.svg" />
+		<link href="/favicon.svg" rel="icon" type="image/svg+xml" />
 		<style>
 			body {
 				margin: 0;

[96m[1m| [0m[90m Read     [0m.gitignore
[92m[1m| [0m[90m Edit     [0m.gitignore
[91m[1m| [0m[90m Bash     [0mCheck git status after gitignore update

On branch master
Your branch is ahead of 'origin/master' by 1 commit.
  (use "git push" to publish your local commits)

Changes not staged for commit:
  (use "git add <file>..." to update what will be committed)
  (use "git restore <file>..." to discard changes in working directory)
	modified:   .aidd/iterations/002.log
	modified:   .gitignore
	modified:   index.html

no changes added to commit (use "git add" and/or "git commit -a")

[91m[1m| [0m[90m Bash     [0mCommit changes

fatal: Unable to create 'D:/applications/sitemap/.git/index.lock': File exists.

Another git process seems to be running in this repository, e.g.
an editor opened by 'git commit'. Please make sure all processes
are terminated then try again. If it still fails, a git process
may have crashed in this repository earlier:
remove the file manually to continue.

[91m[1m| [0m[90m Bash     [0mCheck staged changes

On branch master
Your branch is ahead of 'origin/master' by 1 commit.
  (use "git push" to publish your local commits)

Changes not staged for commit:
  (use "git add <file>..." to update what will be committed)
  (use "git restore <file>..." to discard changes in working directory)
	modified:   .aidd/iterations/002.log
	modified:   .gitignore
	modified:   index.html

no changes added to commit (use "git add" and/or "git commit -a")

[91m[1m| [0m[90m Bash     [0mStage changes for commit

warning: in the working copy of '.aidd/iterations/002.log', CRLF will be replaced by LF the next time Git touches it

[91m[1m| [0m[90m Bash     [0mStage changes
[91m[1m| [0m[90m Bash     [0mRemove git lock file
[91m[1m| [0m[90m Bash     [0mCheck status

On branch master
Your branch is ahead of 'origin/master' by 1 commit.
  (use "git push" to publish your local commits)

Changes to be committed:
  (use "git restore --staged <file>..." to unstage)
	modified:   .aidd/iterations/002.log
	modified:   .gitignore
	modified:   index.html

Changes not staged for commit:
  (use "git add <file>..." to update what will be committed)
  (use "git restore <file>..." to discard changes in working directory)
	modified:   .aidd/iterations/002.log


[91m[1m| [0m[90m Bash     [0mVerify commit

On branch master
Your branch is ahead of 'origin/master' by 1 commit.
  (use "git push" to publish your local commits)

Changes to be committed:
  (use "git restore --staged <file>..." to unstage)
	modified:   .aidd/iterations/002.log
	modified:   .gitignore
	modified:   index.html

Changes not staged for commit:
  (use "git add <file>..." to update what will be committed)
  (use "git restore <file>..." to discard changes in working directory)
	modified:   .aidd/iterations/002.log


[91m[1m| [0m[90m Bash     [0mCommit changes

[master 4b44a57] onboard: verify project state and update gitignore
 3 files changed, 352 insertions(+), 1 deletion(-)

[91m[1m| [0m[90m Bash     [0mShow recent commits

4b44a57 onboard: verify project state and update gitignore
01b6570 onboard: Initialize AI development tracking foundation
eddd186 .

[91m[1m| [0m[90m Bash     [0mCheck final status

On branch master
Your branch is ahead of 'origin/master' by 2 commits.
  (use "git push" to publish your local commits)

Changes not staged for commit:
  (use "git add <file>..." to update what will be committed)
  (use "git restore <file>..." to discard changes in working directory)
	modified:   .aidd/iterations/002.log

no changes added to commit (use "git add" and/or "git commit -a")



warning: in the working copy of '.aidd/iterations/002.log', CRLF will be replaced by LF the next time Git touches it
[master 9f597c2] onboard: verify project state and update gitignore
 Date: Wed Jan 7 11:34:43 2026 -0600
 3 files changed, 424 insertions(+), 1 deletion(-)

[91m[1m| [0m[90m Bash     [0mAmend commit with all changes[91m[1m| [0m[90m Bash     [0mCheck iteration log diff

warning: in the working copy of '.aidd/iterations/002.log', CRLF will be replaced by LF the next time Git touches it
diff --git a/.aidd/iterations/002.log b/.aidd/iterations/002.log
index 45aafac..eca4c0e 100644
--- a/.aidd/iterations/002.log
+++ b/.aidd/iterations/002.log
@@ -608,3 +608,29 @@ Changes not staged for commit:
 [master 4b44a57] onboard: verify project state and update gitignore
  3 files changed, 352 insertions(+), 1 deletion(-)
 
+[91m[1m| [0m[90m Bash     [0mShow recent commits
+
+4b44a57 onboard: verify project state and update gitignore
+01b6570 onboard: Initialize AI development tracking foundation
+eddd186 .
+
+[91m[1m| [0m[90m Bash     [0mCheck final status
+
+On branch master
+Your branch is ahead of 'origin/master' by 2 commits.
+  (use "git push" to publish your local commits)
+
+Changes not staged for commit:
+  (use "git add <file>..." to update what will be committed)
+  (use "git restore <file>..." to discard changes in working directory)
+	modified:   .aidd/iterations/002.log
+
+no changes added to commit (use "git add" and/or "git commit -a")
+
+
+
+warning: in the working copy of '.aidd/iterations/002.log', CRLF will be replaced by LF the next time Git touches it
+[master 9f597c2] onboard: verify project state and update gitignore
+ Date: Wed Jan 7 11:34:43 2026 -0600
+ 3 files changed, 424 insertions(+), 1 deletion(-)
+

